Date,Company,Action,Channel,Summary,Next Step,Owner
2026-02-05,EasyRecycle ApS,Research,Web,"PRIORITY PROSPECT IDENTIFIED. 52 employees, €1.7M revenue, Frederikshavn. ISO 9001/14001/27001/27701. EY Entrepreneur nominee 2024. Perfect fit for Denmark.",Prepare outreach email,Forge
2026-02-05,Remade in Sweden AB,Research,Web,"Strong Swedish prospect. 18 employees, €1.5M, Stockholm area. ISO 9001/14001/27001. Amazon customer. Focus on repair/refurb.",Prepare outreach email,Forge
2026-02-05,ReuseIT Sweden AB,Research,Web,"Swedish ITAD, 34 employees, €18.6M revenue, Växjö. Good financials. Part of larger group - need to verify independence.",Verify group structure,Forge
2026-02-05,Revac AS,Research,Web,"Initial research complete. 147 employees, €52M revenue, ISO 9001/14001, ITAD division uses YouWipe. Certus customer.",Score and qualify,Forge
2026-02-05,Danoffice IT,Disqualified,Web,"Too large: 300+ employees, €400M revenue, global offices. Not target segment.",None - disqualified,Forge
2026-02-05,Huset Venture,Research,Web,"Social enterprise in Aarhus. IT recycling with social mission (flex-jobs). Different model - may be interesting for CSR angle but not primary ITAD partner.",Low priority,Forge
2026-02-05,BuyBackIT.dk,Research,Web,"Small Danish ITAD (~5 employees). Too small to be Return Hub but good to know exists.",Monitor,Forge
